Item,Binomial,WordA,WordB,Questions,Answer,SentenceType,Sentence,PrimeType,Prime,audio,Condition,List
2,arts and crafts,arts,crafts,Does Lilly enjoy run when she's stressed?,n,Sentence (alphabetical),+ Lilly enjoys doing arts and crafts to relax when she is stressed.,nonalphabetical,Crafts and arts are a wonderful way to express creativity through handmade projects.,audio/prime_nonalpha/Crafts_and_arts_are_a_wonderful_way_to_express_creativity_through_handmade_projects.wav,3,6
24,law and order,law,order,Was there chaos?,n,Sentence (alphabetical),+ There was a lack of law and order that caused some chaos.,unrelated,"She took a long walk through the city, marveling at the towering skyscrapers.","audio/prime_unrelated/She_took_a_long_walk_through_the_city,_marveling_at_the_towering_skyscrapers.wav",5,6
3,arts and sciences,arts,sciences,Did Jessica plan on going to college?,y,Sentence (nonalphabetical),+ Jessica couldn't decide between studying sciences and arts in college.,alphabetical,A well-rounded education often includes a balance of arts and sciences.,audio/prime_alpha/A_well-rounded_education_often_includes_a_balance_of_arts_and_sciences.wav,2,6
12,development and research,development,research,Did Emily stay in her field?,n,Sentence (alphabetical),+ Emily was in development and research but eventually decided to leave.,unrelated,His suitcase was packed with essentials and a few souvenirs from his last adventure.,audio/prime_unrelated/His_suitcase_was_packed_with_essentials_and_a_few_souvenirs_from_his_last_adventure.wav,5,6
22,goods and services,goods,services,Were the village people willing to trade?,n,Sentence (alphabetical),+ The village people would not trade goods and services for money.,alphabetical,The store offers a wide variety of goods and services to meet customer needs.,audio/prime_alpha/The_store_offers_a_wide_variety_of_goods_and_services_to_meet_customer_needs.wav,1,6
7,brother and sister,brother,sister,Are Paul's siblings cool?,y,Sentence (nonalphabetical),+ Paul wants to spend time with his sister and brother because they're cool.,nonalphabetical,The sister and brother shared a bond that no distance could weaken.,audio/prime_nonalpha/The_sister_and_brother_shared_a_bond_that_no_distance_could_weaken.wav,4,6
25,men and women,men,women,Were the people in Jen's dance class talented?,y,Sentence (nonalphabetical),+ Jen thought that the women and men in her dance class were all very talented.,nonalphabetical,The disparity between the wages of men and women in the workforce is a major concern for many.,audio/prime_nonalpha/The_disparity_between_the_wages_of_men_and_women_in_the_workforce_is_a_major_concern_for_many.wav,4,6
5,blood and flesh,blood,flesh,Did Nick consider Rhonda to be family?,y,Sentence (nonalphabetical),+ Although Rhonda was not Nick's flesh and blood he considered her family.,unrelated,"With a deep breath, she stepped onto the stage, her heart pounding in her chest.","audio/prime_unrelated/With_a_deep_breath,_she_stepped_onto_the_stage,_her_heart_pounding_in_her_chest.wav",6,6
29,pepper and salt,pepper,salt,Is the food bland?,y,Sentence (nonalphabetical),+ The food is in need of salt and pepper because it's rather bland.,unrelated,"The dog barked at the mailman every day, as if it were his sworn duty.","audio/prime_unrelated/The_dog_barked_at_the_mailman_every_day,_as_if_it_were_his_sworn_duty.wav",6,6
13,error and trial,error,trial,Was Hal still stuck on the math problem?,n,Sentence (nonalphabetical),+ Hal solved the math problem by trial and error because he was lazy.,nonalphabetical,Sometimes it feels like error and trial is the only way to learn.,audio/prime_nonalpha/Sometimes_it_feels_like_error_and_trial_is_the_only_way_to_learn.wav,4,6
11,death and life,death,life,Is it hard to tell one's circumstances in purgatory?,y,Sentence (nonalphabetical),+ It is hard to tell the difference between life and death when you are in purgatory.,unrelated,The child’s laughter echoed through the park as he chased after a butterfly.,audio/prime_unrelated/The_child’s_laughter_echoed_through_the_park_as_he_chased_after_a_butterfly.wav,6,6
4,black and white,black,white,Do Dalmations usually come in many different colors?,n,Sentence (alphabetical),+ Dalmatians found in colors other than black and white are highly unusual.,alphabetical,"The film is shot entirely in black and white, giving it a timeless quality.","audio/prime_alpha/The_film_is_shot_entirely_in_black_and_white,_giving_it_a_timeless_quality.wav",1,6
18,female and male,female,male,Does the dog breeder have puppies coming?,y,Sentence (alphabetical),+ The dog breeder has female and male puppies coming.,unrelated,"She wrote down her goals in a new journal, determined to make this year different.","audio/prime_unrelated/She_wrote_down_her_goals_in_a_new_journal,_determined_to_make_this_year_different.wav",5,6
15,father and son,father,son,Does Eric hate movies?,n,Sentence (nonalphabetical),+ Eric enjoys going to the movies with his son and father so much.,alphabetical,The bond between father and son grew deeper with each passing year.,audio/prime_alpha/The_bond_between_father_and_son_grew_deeper_with_each_passing_year.wav,2,6
6,boys and girls,boys,girls,Did the teacher separate the students into many groups?,n,Sentence (alphabetical),+ The teacher separated the boys and girls into two groups.,unrelated,"The mountain trail was steep, but the view from the top made every step worth it.","audio/prime_unrelated/The_mountain_trail_was_steep,_but_the_view_from_the_top_made_every_step_worth_it.wav",5,6
14,fall and rise,fall,rise,Was the narrator sick because of the waves?,y,Sentence (alphabetical),+ I've gotten particularly ill due to the fall and rise of the waves.,nonalphabetical,The documentary charts the rise and fall of a once-beloved artist.,audio/prime_nonalpha/The_documentary_charts_the_rise_and_fall_of_a_once-beloved_artist.wav,3,6
8,brothers and sisters,brothers,sisters,Does Andrew live alone?,n,Sentence (alphabetical),"+ Andrew shared with his brothers and sisters, so he was excited to have a roomate.",nonalphabetical,I always love seeing my sisters and brothers when I go home for the holidays.,audio/prime_nonalpha/I_always_love_seeing_my_sisters_and_brothers_when_I_go_home_for_the_holidays.wav,3,6
9,cause and effect,cause,effect,Did Ryan research about inflation?,y,Sentence (nonalphabetical),"+ Ryan was uncertain about the effect and cause of inflation, so he did some research.",alphabetical,The gathering was filled with laughter from brothers and sisters catching up after a long time apart.,audio/prime_alpha/The_gathering_was_filled_with_laughter_from_brothers_and_sisters_catching_up_after_a_long_time_apart.wav,2,6
10,days and nights,days,nights,Did Finn easily write his novel?,n,Sentence (alphabetical),+ Finn spent many days and nights working on writing his novel.,alphabetical,The desert's harshness is evident in the extreme days and nights.,audio/prime_alpha/The_deserts_harshness_is_evident_in_the_extreme_days_and_nights.wav,1,6
17,feet and hands,feet,hands,Were the child's limbs fine?,n,Sentence (nonalphabetical),+ The child's hands and feet were numb.,unrelated,The crisp autumn air was filled with the scent of pine and fallen leaves.,audio/prime_unrelated/The_crisp_autumn_air_was_filled_with_the_scent_of_pine_and_fallen_leaves.wav,6,6
26,money and time,money,time,Was it an easy project?,n,Sentence (alphabetical),+ The amount of money and time required to fix it made it quite the project.,nonalphabetical,Managing time and money effectively is key to achieving financial goals.,audio/prime_nonalpha/Managing_time_and_money_effectively_is_key_to_achieving_financial_goals.wav,3,6
21,gentlemen and ladies,gentlemen,ladies,Did the hostess refuse to help the customers?,n,Sentence (nonalphabetical),+ The hostess in the venue lead the ladies and gentlemen to their respective tables.,alphabetical,The event was attended by both gentlemen and ladies dressed in elegant attire.,audio/prime_alpha/The_event_was_attended_by_both_gentlemen_and_ladies_dressed_in_elegant_attire.wav,2,6
1,arms and legs,arms,legs,Did Sandra get into a bike accident?,y,Sentence (nonalphabetical),+ Sandra broke her legs and arms because she got into a bike accident.,nonalphabetical,When he gets upset he crosses his legs and arms in a very tense manner.,audio/prime_nonalpha/When_he_gets_upset_he_crosses_his_legs_and_arms_in_a_very_tense_manner.wav,4,6
20,gas and oil,gas,oil,Is Sam uneducated about cars?,y,Sentence (alphabetical),+ Sam didn't know the difference between gas and oil so she ruined her car.,nonalphabetical,The economy in this region is heavily dependent on oil and gas production.,audio/prime_nonalpha/The_economy_in_this_region_is_heavily_dependent_on_oil_and_gas_production.wav,3,6
23,husband and wife,husband,wife,Was Michelle surprised by what he learned?,y,Sentence (nonalphabetical),+ Michelle was surprised to learn that the wife and husband were getting a divorce.,unrelated,The old house creaked and groaned with every gust of wind.,audio/prime_unrelated/The_old_house_creaked_and_groaned_with_every_gust_of_wind.wav,6,6
19,fruits and vegetables,fruits,vegetables,Did Paul eat unhealthily growing up?,n,Sentence (nonalphabetical),"+ Growing up, Paul ate his vegetables and fruits everyday.",nonalphabetical,A healthy diet includes a balance of vegetables and fruits for essential nutrients.,audio/prime_nonalpha/A_healthy_diet_includes_a_balance_of_vegetables_and_fruits_for_essential_nutrients.wav,4,6
16,feelings and thoughts,feelings,thoughts,Does get confused when she's frustrated?,y,Sentence (alphabetical),"+ Whenever Pat was frustrated, her feelings and thoughts got muddled.",alphabetical,Poetry often tries to capture the subtle interplay of feelings and thoughts.,audio/prime_alpha/Poetry_often_tries_to_capture_the_subtle_interplay_of_feelings_and_thoughts.wav,1,6
30,place and time,place,time,Was it easy to plan the meeting?,n,Sentence (alphabetical),+ Finding a place and time for the meeting was very difficult.,unrelated,"A gentle breeze rustled the leaves, carrying the scent of jasmine through the air.","audio/prime_unrelated/A_gentle_breeze_rustled_the_leaves,_carrying_the_scent_of_jasmine_through_the_air.wav",5,6
27,mr. and mrs.,mr.,mrs.,Is it the case that the couple aren't married?,y,Sentence (nonalphabetical),+ The couple call each other mrs. and mr. Smith even though they aren't married.,alphabetical,"The invitation was addressed to Mr. and Mrs. Peterson, inviting them to the gala.","audio/prime_alpha/The_invitation_was_addressed_to_Mr_and_Mrs_Peterson,_inviting_them_to_the_gala.wav",2,6
28,north and south,north,south,Did the family stay in the same place?,n,Sentence (alphabetical),+ The family moved north and south a couple of times.,alphabetical,The campaign has supporters from both north and south regions.,audio/prime_alpha/The_campaign_has_supporters_from_both_north_and_south_regions.wav,1,6
186,NA,NA,NA,Did he watch the fish?,y,filler,+ She felt a sense of wonder as she gazed up at the stars.,filler,He watched the fish swim lazily in the pond.,audio/prime_filler/He_watched_the_fish_swim_lazily_in_the_pond.wav,NA,0
175,NA,NA,NA,Did he read aloud?,n,filler,"+ She walked through the meadow, admiring the wildflowers.",filler,"He read quietly by the window, bathed in soft light.","audio/prime_filler/He_read_quietly_by_the_window,_bathed_in_soft_light.wav",NA,0
195,NA,NA,NA,Did she place a rocker in her book?,n,filler,"+ The bookstore was cozy, filled with warm lights and books.",filler,She placed a feather in her book as a keepsake.,audio/prime_filler/She_placed_a_feather_in_her_book_as_a_keepsake.wav,NA,0
169,NA,NA,NA,Was the ladybug in her house?,n,filler,+ The street musician played a hauntingly beautiful melody.,filler,She watched a ladybug crawl along the edge of a leaf.,audio/prime_filler/She_watched_a_ladybug_crawl_along_the_edge_of_a_leaf.wav,NA,0
101,NA,NA,NA,Did she wander the aisles with her friends?,n,filler,+ She spent hours wandering the aisles of the bookstore alone.,filler,The sound of distant thunder warned of a coming storm.,audio/prime_filler/The_sound_of_distant_thunder_warned_of_a_coming_storm.wav,NA,0
148,NA,NA,NA,Was the bakery small?,y,filler,+ The small bakery was filled with the scent of cinnamon rolls.,filler,She watched the fireflies dance in the warm evening air.,audio/prime_filler/She_watched_the_fireflies_dance_in_the_warm_evening_air.wav,NA,0
139,NA,NA,NA,Was the seashell strong?,n,filler,"+ She held the fragile seashell, admiring its unique pattern.",filler,"The campfire crackled, casting shadows on their faces.","audio/prime_filler/The_campfire_crackled,_casting_shadows_on_their_faces.wav",NA,0
131,NA,NA,NA,Did he expect the gust of wind?,n,filler,+ He felt a sudden gust of wind as he stepped outside.,filler,She braided her hair while listening to the birds singing.,audio/prime_filler/She_braided_her_hair_while_listening_to_the_birds_singing.wav,NA,0
158,NA,NA,NA,Did she close her eyes?,y,filler,"+ The air smelled like rain, fresh and earthy after the storm.",filler,"She closed her eyes, feeling the warmth of the sun.","audio/prime_filler/She_closed_her_eyes,_feeling_the_warmth_of_the_sun.wav",NA,0
114,NA,NA,NA,Was there coffee in the cafe?,y,filler,+ The cafe smelled of freshly baked bread and roasted coffee.,filler,"The beach was empty, save for a few scattered seashells.","audio/prime_filler/The_beach_was_empty,_save_for_a_few_scattered_seashells.wav",NA,0
132,NA,NA,NA,Was the evening getting colder?,y,filler,+ She wrapped her scarf tighter as the evening grew colder.,filler,The waves crashed rhythmically against the rocky shore.,audio/prime_filler/The_waves_crashed_rhythmically_against_the_rocky_shore.wav,NA,0
179,NA,NA,NA,Was he watching the ocean?,n,filler,"+ She gazed at the ocean, lost in her own thoughts.",filler,He watched the clouds drift across the open sky.,audio/prime_filler/He_watched_the_clouds_drift_across_the_open_sky.wav,NA,0
126,NA,NA,NA,Did she keep a journal?,y,filler,+ She kept a journal filled with her thoughts and dreams.,filler,"He sat on the rooftop, admiring the city lights below.","audio/prime_filler/He_sat_on_the_rooftop,_admiring_the_city_lights_below.wav",NA,0
178,NA,NA,NA,Was the bakery cozy?,y,filler,+ The city lights reflected on the wet streets after the rain.,filler,The scent of fresh bread filled the cozy little bakery.,audio/prime_filler/The_scent_of_fresh_bread_filled_the_cozy_little_bakery.wav,NA,0
166,NA,NA,NA,Was the beach empty?,y,filler,"+ He opened the old book, its pages yellowed with age.",filler,The sound of laughter echoed across the empty beach.,audio/prime_filler/The_sound_of_laughter_echoed_across_the_empty_beach.wav,NA,0
193,NA,NA,NA,Did he watch the sunrise?,n,filler,"+ The breeze ruffled her hair, carrying the scent of salt.",filler,"He sat on the bench, watching the sun go down.","audio/prime_filler/He_sat_on_the_bench,_watching_the_sun_go_down.wav",NA,0
192,NA,NA,NA,Was the bakery busy?,y,filler,+ He tied his shoes and prepared for the long hike ahead.,filler,"The bakery was busy, filled with customers chatting.","audio/prime_filler/The_bakery_was_busy,_filled_with_customers_chatting.wav",NA,0
111,NA,NA,NA,Was the room noisy?,n,filler,+ The room was silent except for the ticking of an old clock.,filler,She loved the feel of the ocean breeze against her face.,audio/prime_filler/She_loved_the_feel_of_the_ocean_breeze_against_her_face.wav,NA,0
191,NA,NA,NA,Did she watch the airplanes?,n,filler,+ The air was thick with the scent of pine and fresh rain.,filler,She watched the kite soar high above the field.,audio/prime_filler/She_watched_the_kite_soar_high_above_the_field.wav,NA,0
163,NA,NA,NA,Was he watching the house?,n,filler,+ The city skyline was breathtaking against the evening sky.,filler,"He looked out at the waves, lost in his thoughts.","audio/prime_filler/He_looked_out_at_the_waves,_lost_in_his_thoughts.wav",NA,0
168,NA,NA,NA,Was the garden overgrown?,y,filler,+ She marveled at the intricate patterns on the butterfly's wings.,filler,"The garden was overgrown, filled with wildflowers and weeds.","audio/prime_filler/The_garden_was_overgrown,_filled_with_wildflowers_and_weeds.wav",NA,0
118,NA,NA,NA,Did he watch old films?,y,filler,+ He spent his evening watching old black-and-white films.,filler,She wore a necklace with a delicate silver pendant.,audio/prime_filler/She_wore_a_necklace_with_a_delicate_silver_pendant.wav,NA,0
141,NA,NA,NA,Did the new watch chime?,n,filler,"+ The old clock chimed, signaling the hour with a soft ring.",filler,She wore a vibrant scarf that stood out in the crowd.,audio/prime_filler/She_wore_a_vibrant_scarf_that_stood_out_in_the_crowd.wav,NA,0
189,NA,NA,NA,Was it a busy night?,n,filler,"+ The small village was quiet, nestled in the valley.",filler,"The night was calm, with only the sound of crickets.","audio/prime_filler/The_night_was_calm,_with_only_the_sound_of_crickets.wav",NA,0
104,NA,NA,NA,Did she pick wildflowers?,y,filler,+ She picked wildflowers and placed them gently in her hair.,filler,She carefully folded the letter and placed it in an envelope.,audio/prime_filler/She_carefully_folded_the_letter_and_placed_it_in_an_envelope.wav,NA,0
151,NA,NA,NA,Did she notice a bird?,n,filler,+ He watched as a flock of birds took off into the sky.,filler,She noticed a butterfly resting on a nearby flower.,audio/prime_filler/She_noticed_a_butterfly_resting_on_a_nearby_flower.wav,NA,0
145,NA,NA,NA,DId she trace the shapes in the dirt?,n,filler,+ She traced shapes in the sand with her finger absentmindedly.,filler,"The park was empty, covered in a blanket of fallen leaves.","audio/prime_filler/The_park_was_empty,_covered_in_a_blanket_of_fallen_leaves.wav",NA,0
198,NA,NA,NA,Was the forest quiet?,y,filler,+ She wore a necklace with a tiny silver locket.,filler,The sound of the waterfall filled the quiet forest.,audio/prime_filler/The_sound_of_the_waterfall_filled_the_quiet_forest.wav,NA,0
171,NA,NA,NA,Did he admire the sunrise?,n,filler,+ She felt the cool breeze brush against her skin softly.,filler,He admired the sunset from the top of the hill.,audio/prime_filler/He_admired_the_sunset_from_the_top_of_the_hill.wav,NA,0
154,NA,NA,NA,Did she enjoy the mountain air?,y,filler,+ The sound of waves crashing was soothing and rhythmic.,filler,"She took a deep breath, savoring the fresh mountain air.","audio/prime_filler/She_took_a_deep_breath,_savoring_the_fresh_mountain_air.wav",NA,0
