Item,Binomial,WordA,WordB,Questions,Answer,SentenceType,Sentence,PrimeType,Prime,audio,Condition,List,RelFreq,GenPref,target_freq,prime_freq
21,gentlemen and ladies,gentlemen,ladies,Did the hostess refuse to help the customers?,n,Sentence (nonalphabetical),+ The hostess in the venue lead the ladies and gentlemen to their respective tables.,nonalphabetical,The event was attended by both ladies and gentlemen dressed in elegant attire.,audio/prime_nonalpha/The_event_was_attended_by_both_ladies_and_gentlemen_dressed_in_elegant_attire.wav,4,2,-0.40864716032,0.5176318827,frequent,frequent
19,fruits and vegetables,fruits,vegetables,Did Paul eat unhealthily growing up?,n,Sentence (nonalphabetical),"+ Growing up, Paul ate his vegetables and fruits everyday at each meal.",alphabetical,A healthy diet includes a balance of fruits and vegetables for essential nutrients.,audio/prime_alpha/A_healthy_diet_includes_a_balance_of_fruits_and_vegetables_for_essential_nutrients.wav,2,2,0.3501050683,0.6085325242,not-frequent,frequent
5,blood and flesh,blood,flesh,Did Nick consider Rhonda to be family?,y,Sentence (alphabetical),+ Although Rhonda was not Nick's blood and flesh he considered her family.,unrelated,"With a deep breath, she stepped onto the stage, her heart pounding in her chest.","audio/prime_unrelated/With_a_deep_breath,_she_stepped_onto_the_stage,_her_heart_pounding_in_her_chest.wav",5,2,-0.47360396965,0.469076088,not-frequent,unrelated
15,father and son,father,son,Does Eric hate movies?,n,Sentence (alphabetical),+ Eric enjoys watching movies with his father and son so much that he goes often.,unrelated,"The dog wagged its tail eagerly, hoping for a treat.","audio/prime_unrelated/The_dog_wagged_its_tail_eagerly,_hoping_for_a_treat.wav",5,2,0.4679236355000001,0.5278980018,frequent,unrelated
30,place and time,place,time,Was it easy to plan the meeting?,n,Sentence (nonalphabetical),+ Finding a time and place for the meeting was very difficult.,unrelated,"A gentle breeze rustled the leaves, carrying the scent of jasmine through the air.","audio/prime_unrelated/A_gentle_breeze_rustled_the_leaves,_carrying_the_scent_of_jasmine_through_the_air.wav",6,2,-0.3613230549,0.5553675804,frequent,unrelated
3,arts and sciences,arts,sciences,Did Jessica plan on going to college?,y,Sentence (nonalphabetical),+ Jessica couldn't decide between studying sciences and arts at her time in  college.,unrelated,"The library was silent, except for the occasional sound of pages turning.","audio/prime_unrelated/The_library_was_silent,_except_for_the_occasional_sound_of_pages_turning.wav",6,2,0.4544574614,0.4933750742,not-frequent,unrelated
12,development and research,development,research,Did Emily stay in her field?,n,Sentence (alphabetical),+ Emily was in development and research but eventually decided to leave.,nonalphabetical,Many years of research and development went into the company's new product.,audio/prime_nonalpha/Many_years_of_research_and_development_went_into_the_companys_new_product.wav,3,2,-0.48074983772,0.2293127498,not-frequent,frequent
24,law and order,law,order,Was there chaos?,n,Sentence (nonalphabetical),+ There was a lack of order and law that caused some chaos.,unrelated,"She took a long walk through the city, marveling at the towering skyscrapers.","audio/prime_unrelated/She_took_a_long_walk_through_the_city,_marveling_at_the_towering_skyscrapers.wav",6,2,0.4852172766,0.8870848891,not-frequent,unrelated
27,mr. and mrs.,mr.,mrs.,Is it the case that the couple aren't married?,y,Sentence (alphabetical),+ The couple call each other mr. and mrs. Smith even though they aren't married.,unrelated,"They watched the fireworks explode in the night sky, their faces lit up with excitement.","audio/prime_unrelated/They_watched_the_fireworks_explode_in_the_night_sky,_their_faces_lit_up_with_excitement.wav",5,2,0.4980908174000001,0.6408346416,frequent,unrelated
25,men and women,men,women,Were the people in Jen's dance class talented?,y,Sentence (nonalphabetical),+ Jen thought that the women and men in her dance class were all very talented.,unrelated,"The cafe was cozy, with soft music playing and the smell of fresh pastries in the air.","audio/prime_unrelated/The_cafe_was_cozy,_with_soft_music_playing_and_the_smell_of_fresh_pastries_in_the_air.wav",6,2,0.4064281412,0.7288977898,not-frequent,unrelated
26,money and time,money,time,Was it an easy project?,n,Sentence (nonalphabetical),+ The amount of time and money required to fix it made it quite the project.,unrelated,"She wrapped the scarf around her neck, bracing herself against the winter chill.","audio/prime_unrelated/She_wrapped_the_scarf_around_her_neck,_bracing_herself_against_the_winter_chill.wav",6,2,-0.3966303172,0.3490212064,frequent,unrelated
7,brother and sister,brother,sister,Are Paul's siblings cool?,y,Sentence (nonalphabetical),+ Paul wants to spend time with his sister and brother because they are cool.,unrelated,"The cat curled up on the windowsill, basking in a patch of warm sunlight.","audio/prime_unrelated/The_cat_curled_up_on_the_windowsill,_basking_in_a_patch_of_warm_sunlight.wav",6,2,0.3382719058,0.6344814705,not-frequent,unrelated
23,husband and wife,husband,wife,Was Michelle surprised by what he learned?,y,Sentence (nonalphabetical),+ Michelle was surprised to learn that the wife and husband were getting a divorce.,unrelated,The old house creaked and groaned with every gust of wind.,audio/prime_unrelated/The_old_house_creaked_and_groaned_with_every_gust_of_wind.wav,6,2,0.4745981449,0.5027550125,not-frequent,unrelated
28,north and south,north,south,Did the family stay in the same place?,n,Sentence (nonalphabetical),+ The family moved south and north a couple of times.,unrelated,The antique store was filled with treasures from a bygone era.,audio/prime_unrelated/The_antique_store_was_filled_with_treasures_from_a_bygone_era.wav,6,2,0.4390120705,0.610818675,not-frequent,unrelated
13,error and trial,error,trial,Was Hal still stuck on the math problem?,n,Sentence (alphabetical),+ Hal solved the math problem by error and trial because he was lazy.,unrelated,"The aroma of freshly baked bread drifted from the kitchen, inviting everyone inside.","audio/prime_unrelated/The_aroma_of_freshly_baked_bread_drifted_from_the_kitchen,_inviting_everyone_inside.wav",5,2,-0.4995134398482,0.1682363,not-frequent,unrelated
4,black and white,black,white,Do Dalmations usually come in many different colors?,n,Sentence (nonalphabetical),+ Dalmatians found in colors other than white and black are really quite unusual.,alphabetical,"The film is shot entirely in black and white, giving it a timeless quality.","audio/prime_alpha/The_film_is_shot_entirely_in_black_and_white,_giving_it_a_timeless_quality.wav",2,2,0.33220185449999995,0.4175274348,not-frequent,frequent
1,arms and legs,arms,legs,Did Sandra get into a bike accident?,y,Sentence (nonalphabetical),+ Sandra broke her legs and arms because she got into a bike accident.,alphabetical,When he gets upset he crosses his arms and legs in a very tense manner.,audio/prime_alpha/When_he_gets_upset_he_crosses_his_arms_and_legs_in_a_very_tense_manner.wav,2,2,0.33699264640000004,0.6051687367,not-frequent,frequent
2,arts and crafts,arts,crafts,Does Lilly enjoy run when she's stressed?,n,Sentence (alphabetical),+ Lilly enjoys doing arts and crafts to relax when she is stressed.,alphabetical,Arts and crafts are a wonderful way to express creativity through handmade projects.,audio/prime_alpha/Arts_and_crafts_are_a_wonderful_way_to_express_creativity_through_handmade_projects.wav,1,2,0.4952497357,0.6080373752,frequent,frequent
22,goods and services,goods,services,Were the village people willing to trade?,n,Sentence (alphabetical),+ They would not trade goods and services even for a large sum of money.,unrelated,"They toasted to friendship, clinking their glasses in celebration.","audio/prime_unrelated/They_toasted_to_friendship,_clinking_their_glasses_in_celebration.wav",5,2,0.4925981151,0.6638593473,frequent,unrelated
17,feet and hands,feet,hands,Were the child's limbs fine?,n,Sentence (nonalphabetical),+ The child's hands and feet slowly grew very numb.,nonalphabetical,"The dancer moved her hands and feet gracefully, commanding the stage.","audio/prime_nonalpha/The_dancer_moved_her_hands_and_feet_gracefully,_commanding_the_stage.wav",4,2,-0.382257009,0.4219806788,frequent,frequent
20,gas and oil,gas,oil,Is Sam uneducated about cars?,y,Sentence (alphabetical),+ Sam didn't know the difference between gas and oil so she ruined her car.,unrelated,"He sat by the campfire, warming his hands as the stars sparkled above.","audio/prime_unrelated/He_sat_by_the_campfire,_warming_his_hands_as_the_stars_sparkled_above.wav",5,2,-0.4145522406,0.414941423,not-frequent,unrelated
11,death and life,death,life,Is it hard to tell one's circumstances in purgatory?,y,Sentence (alphabetical),+ It is hard to tell the difference between death and life when you are in purgatory.,nonalphabetical,"In many cultures, life and death are seen as intertwined parts of a greater cycle.","audio/prime_nonalpha/In_many_cultures,_life_and_death_are_seen_as_intertwined_parts_of_a_greater_cycle.wav",3,2,-0.4380721283,0.1047131005,not-frequent,frequent
6,boys and girls,boys,girls,Did the teacher separate the students into many groups?,n,Sentence (alphabetical),+ The teacher separated the boys and girls into two small groups.,alphabetical,Boys and girls eagerly gathered around the storyteller for an afternoon of tales.,audio/prime_alpha/Boys_and_girls_eagerly_gathered_around_the_storyteller_for_an_afternoon_of_tales.wav,1,2,0.3825195635000001,0.6258780033,frequent,frequent
9,cause and effect,cause,effect,Did Ryan research about inflation?,y,Sentence (nonalphabetical),"+ Ryan was uncertain about the effect and cause of inflation, so he did some research.",alphabetical,The gathering was filled with laughter from brothers and sisters catching up after a long time apart.,audio/prime_alpha/The_gathering_was_filled_with_laughter_from_brothers_and_sisters_catching_up_after_a_long_time_apart.wav,2,2,0.4893920566,0.78038961,not-frequent,frequent
29,pepper and salt,pepper,salt,Is the food bland?,y,Sentence (alphabetical),+ The food is in need of pepper and salt because it's rather bland.,unrelated,"The dog barked at the mailman every day, as if it were his sworn duty.","audio/prime_unrelated/The_dog_barked_at_the_mailman_every_day,_as_if_it_were_his_sworn_duty.wav",5,2,-0.43924954184,0.2688838616,not-frequent,unrelated
18,female and male,female,male,Does the dog breeder have puppies coming?,y,Sentence (alphabetical),+ The dog breeder said the female and male puppies are coming today.,nonalphabetical,The study found no significant differences in learning styles between male and female students.,audio/prime_nonalpha/The_study_found_no_significant_differences_in_learning_styles_between_male_and_female_students.wav,3,2,-0.42635207012,0.349332677,not-frequent,frequent
8,brothers and sisters,brothers,sisters,Does Andrew live alone?,n,Sentence (alphabetical),"+ Andrew shared with his brothers and sisters, so he was excited to have a roomate.",unrelated,"They exchanged a knowing glance, each understanding the other's unspoken thoughts.","audio/prime_unrelated/They_exchanged_a_knowing_glance,_each_understanding_the_others_unspoken_thoughts.wav",5,2,0.4142402514,0.6388390377,frequent,unrelated
14,fall and rise,fall,rise,Was the narrator sick because of the waves?,y,Sentence (nonalphabetical),+ I've gotten particularly ill due to the rise and fall of the big waves.,nonalphabetical,The documentary charts the rise and fall of a once-beloved artist.,audio/prime_nonalpha/The_documentary_charts_the_rise_and_fall_of_a_once-beloved_artist.wav,4,2,-0.47005192108,0.4320348317,frequent,frequent
16,feelings and thoughts,feelings,thoughts,Does get confused when she's frustrated?,y,Sentence (nonalphabetical),"+ When Pat gets frustrated, her thoughts and feelings get muddled quite quickly.",unrelated,"He flipped through the album, each photograph bringing back a flood of memories.","audio/prime_unrelated/He_flipped_through_the_album,_each_photograph_bringing_back_a_flood_of_memories.wav",6,2,-0.3486352047,0.418338269,frequent,unrelated
10,days and nights,days,nights,Did Finn easily write his novel?,n,Sentence (nonalphabetical),+ Finn spent many nights and days working on writing his novel.,alphabetical,The desert's harshness is evident in the extreme days and nights.,audio/prime_alpha/The_deserts_harshness_is_evident_in_the_extreme_days_and_nights.wav,2,2,0.4144469086,0.6530893812,not-frequent,frequent
198,NA,NA,NA,Was the forest quiet?,y,filler,+ She wore a necklace with a tiny silver locket.,filler,The sound of the waterfall filled the quiet forest.,audio/prime_filler/The_sound_of_the_waterfall_filled_the_quiet_forest.wav,NA,0,NA,NA,NA,NA
173,NA,NA,NA,Did she swim through the ocean?,n,filler,+ He waited patiently as the storm passed overhead.,filler,"She walked through the field, admiring the wildflowers.","audio/prime_filler/She_walked_through_the_field,_admiring_the_wildflowers.wav",NA,0,NA,NA,NA,NA
194,NA,NA,NA,Were there many insects in the field?,y,filler,+ She painted the sunset with bold strokes of orange and red.,filler,The field was alive with the sound of buzzing insects.,audio/prime_filler/The_field_was_alive_with_the_sound_of_buzzing_insects.wav,NA,0,NA,NA,NA,NA
178,NA,NA,NA,Was the bakery cozy?,y,filler,+ The city lights reflected on the wet streets after the rain.,filler,The scent of fresh bread filled the cozy little bakery.,audio/prime_filler/The_scent_of_fresh_bread_filled_the_cozy_little_bakery.wav,NA,0,NA,NA,NA,NA
192,NA,NA,NA,Was the bakery busy?,y,filler,+ He tied his shoes and prepared for the long hike ahead.,filler,"The bakery was busy, filled with customers chatting.","audio/prime_filler/The_bakery_was_busy,_filled_with_customers_chatting.wav",NA,0,NA,NA,NA,NA
107,NA,NA,NA,Were the books clean?,n,filler,+ The old library was filled with dust-covered books and secrets.,filler,She watched as the sun dipped below the distant horizon.,audio/prime_filler/She_watched_as_the_sun_dipped_below_the_distant_horizon.wav,NA,0,NA,NA,NA,NA
112,NA,NA,NA,Was his jacket faded?,y,filler,+ He wore a faded blue jacket that had seen better days.,filler,"A gentle breeze rustled the leaves, filling the silence.","audio/prime_filler/A_gentle_breeze_rustled_the_leaves,_filling_the_silence.wav",NA,0,NA,NA,NA,NA
135,NA,NA,NA,Was the street loud?,n,filler,"+ The street was silent, save for the occasional car passing.",filler,She tucked a flower behind her ear and smiled softly.,audio/prime_filler/She_tucked_a_flower_behind_her_ear_and_smiled_softly.wav,NA,0,NA,NA,NA,NA
189,NA,NA,NA,Was it a busy night?,n,filler,"+ The small village was quiet, nestled in the valley.",filler,"The night was calm, with only the sound of crickets.","audio/prime_filler/The_night_was_calm,_with_only_the_sound_of_crickets.wav",NA,0,NA,NA,NA,NA
123,NA,NA,NA,Was the sand dry?,n,filler,+ She left footprints in the wet sand that soon disappeared.,filler,The soft glow of the candle illuminated her face.,audio/prime_filler/The_soft_glow_of_the_candle_illuminated_her_face.wav,NA,0,NA,NA,NA,NA
174,NA,NA,NA,Were the flowers blooming?,y,filler,+ The old photograph reminded her of distant memories.,filler,The air was filled with the sweet scent of blooming flowers.,audio/prime_filler/The_air_was_filled_with_the_sweet_scent_of_blooming_flowers.wav,NA,0,NA,NA,NA,NA
185,NA,NA,NA,Was the sky bright?,n,filler,+ The trail led them deep into the heart of the forest.,filler,The lighthouse stood tall against the darkening sky.,audio/prime_filler/The_lighthouse_stood_tall_against_the_darkening_sky.wav,NA,0,NA,NA,NA,NA
160,NA,NA,NA,Was the evening breeze gentle?,y,filler,+ She wore a bright yellow dress that caught everyone's eye.,filler,The leaves rustled softly in the gentle evening breeze.,audio/prime_filler/The_leaves_rustled_softly_in_the_gentle_evening_breeze.wav,NA,0,NA,NA,NA,NA
110,NA,NA,NA,Was there sand between her toes?,y,filler,+ She felt the sand between her toes as she walked along the shore.,filler,The fresh scent of pine filled the air as she hiked uphill.,audio/prime_filler/The_fresh_scent_of_pine_filled_the_air_as_she_hiked_uphill.wav,NA,0,NA,NA,NA,NA
103,NA,NA,NA,Was there heavy rain?,n,filler,"+ A soft drizzle began to fall, dampening the crowded streets.",filler,"The forest was dense and mysterious, filled with ancient trees.","audio/prime_filler/The_forest_was_dense_and_mysterious,_filled_with_ancient_trees.wav",NA,0,NA,NA,NA,NA
129,NA,NA,NA,Was it sunny outside?,n,filler,+ She watched the raindrops slide down the windowpane.,filler,The garden was alive with the buzzing of bees and birds.,audio/prime_filler/The_garden_was_alive_with_the_buzzing_of_bees_and_birds.wav,NA,0,NA,NA,NA,NA
191,NA,NA,NA,Did she watch the airplanes?,n,filler,+ The air was thick with the scent of pine and fresh rain.,filler,She watched the kite soar high above the field.,audio/prime_filler/She_watched_the_kite_soar_high_above_the_field.wav,NA,0,NA,NA,NA,NA
161,NA,NA,NA,Was she reckless?,n,filler,"+ The cat stretched lazily, basking in a patch of sunlight.",filler,She carefully arranged flowers in a small glass vase.,audio/prime_filler/She_carefully_arranged_flowers_in_a_small_glass_vase.wav,NA,0,NA,NA,NA,NA
138,NA,NA,NA,Was it bright in the room?,y,filler,"+ The fire crackled, filling the room with warmth and light.",filler,She watched as the fog rolled over the hills silently.,audio/prime_filler/She_watched_as_the_fog_rolled_over_the_hills_silently.wav,NA,0,NA,NA,NA,NA
133,NA,NA,NA,Were they still there?,n,filler,+ The echo of laughter lingered long after they had left.,filler,A faint scent of lavender filled the cozy little room.,audio/prime_filler/A_faint_scent_of_lavender_filled_the_cozy_little_room.wav,NA,0,NA,NA,NA,NA
147,NA,NA,NA,Did he jot down the notes on his computer?,n,filler,"+ He jotted down notes in his notebook, deep in thought.",filler,The old house was filled with memories of past years.,audio/prime_filler/The_old_house_was_filled_with_memories_of_past_years.wav,NA,0,NA,NA,NA,NA
121,NA,NA,NA,Was he stressed out?,n,filler,+ He found comfort in the familiar hum of the city at night.,filler,She made a wish on the first star she saw that night.,audio/prime_filler/She_made_a_wish_on_the_first_star_she_saw_that_night.wav,NA,0,NA,NA,NA,NA
148,NA,NA,NA,Was the bakery small?,y,filler,+ The small bakery was filled with the scent of cinnamon rolls.,filler,She watched the fireflies dance in the warm evening air.,audio/prime_filler/She_watched_the_fireflies_dance_in_the_warm_evening_air.wav,NA,0,NA,NA,NA,NA
146,NA,NA,NA,Did the city lights glow?,y,filler,"+ The city lights glowed, creating a warm and cozy atmosphere.",filler,He admired the intricate patterns on the vintage clock.,audio/prime_filler/He_admired_the_intricate_patterns_on_the_vintage_clock.wav,NA,0,NA,NA,NA,NA
176,NA,NA,NA,Was it night time?,y,filler,+ The sun was just beginning to peek over the horizon.,filler,The moon reflected on the calm surface of the lake.,audio/prime_filler/The_moon_reflected_on_the_calm_surface_of_the_lake.wav,NA,0,NA,NA,NA,NA
195,NA,NA,NA,Did she place a rocker in her book?,n,filler,"+ The bookstore was cozy, filled with warm lights and books.",filler,She placed a feather in her book as a keepsake.,audio/prime_filler/She_placed_a_feather_in_her_book_as_a_keepsake.wav,NA,0,NA,NA,NA,NA
126,NA,NA,NA,Did she keep a journal?,y,filler,+ She kept a journal filled with her thoughts and dreams.,filler,"He sat on the rooftop, admiring the city lights below.","audio/prime_filler/He_sat_on_the_rooftop,_admiring_the_city_lights_below.wav",NA,0,NA,NA,NA,NA
141,NA,NA,NA,Did the new watch chime?,n,filler,"+ The old clock chimed, signaling the hour with a soft ring.",filler,She wore a vibrant scarf that stood out in the crowd.,audio/prime_filler/She_wore_a_vibrant_scarf_that_stood_out_in_the_crowd.wav,NA,0,NA,NA,NA,NA
155,NA,NA,NA,Was the sky dark?,n,filler,"+ He looked up, noticing the clouds beginning to part.",filler,The clouds drifted lazily across the bright blue sky.,audio/prime_filler/The_clouds_drifted_lazily_across_the_bright_blue_sky.wav,NA,0,NA,NA,NA,NA
139,NA,NA,NA,Was the seashell strong?,n,filler,"+ She held the fragile seashell, admiring its unique pattern.",filler,"The campfire crackled, casting shadows on their faces.","audio/prime_filler/The_campfire_crackled,_casting_shadows_on_their_faces.wav",NA,0,NA,NA,NA,NA
